{
    "$schema": "https://sci-d-vis.com/schema/wtrl-json-0.3.0.schema.json",
    "$id": "urn:waterlint:wtrl-json:0.25.0:core:rfc-2119:e76b3b99b0a9c3c15bb087c344869fa997d284b61d82ec9682dadc13b8874103",
    "__WTRL_VERSION__": {
        "waterloo": "0.25.0",
        "schema": "0.3.0"
    },
    "__WTRL_META__": {
        "generated_at": "2026-09-27T10:59:21+02:00",
        "generator": "waterlint",
        "scope": "core",
        "flavour": "rfc-2119"
    },
    "__WTRL_ROLES__": {
        "attr": "Attribute name",
        "cmd": "Shell or CLI command",
        "class": "Class name",
        "dfn": "Definition of a term",
        "file": "File or path",
        "func": "Function or callable",
        "key": "Key on the keyboard",
        "label": "Section/Subsection label",
        "lit": "Literal text or code",
        "mod": "Module name",
        "norm": "Normativity keyword used as metadata",
        "op": "Operator symbol",
        "opt": "Command-line option or flag",
        "pkg": "Package name",
        "url": "URL",
        "tag": "Tag or marker",
        "term": "Domain-specific term",
        "type": "Type name or annotation",
        "value": "Concrete value",
        "var": "Variable name",
        "var_type": "Variable and type, like 'var:type'"
    },
    "__WTRL_SCOPES__": {
        "public": {
            "value": 10,
            "description": ""
        },
        "extension": {
            "value": 20,
            "description": ""
        },
        "core": {
            "value": 30,
            "description": ""
        }
    },
    "__WTRL_TOC_MODULES__": {
        "showcase_roles": "/__WTRL_OBJECTS__/showcase_roles"
    },
    "__WTRL_TOC_CLASSES__": {
        "showcase_roles.X": "/__WTRL_OBJECTS__/showcase_roles.X"
    },
    "__WTRL_TOC_CALLABLES__": {},
    "__WTRL_TOC_TYPES__": {},
    "__WTRL_TOC_VARIABLES__": {},
    "__WTRL_TOC_CONSTANTS__": {},
    "__WTRL_OBJECTS__": {
        "showcase_roles": {
            "doc": {
                "Preamble": {
                    "profile": "module",
                    "scope": [
                        "core"
                    ],
                    "normative_sections": [
                        "Contract",
                        "Definitions"
                    ]
                },
                "Definitions": {
                    "ABC": {
                        "variations": [],
                        "text": [
                            "A term |dfn|`ABC` we reference by role |lit|`|term|`."
                        ]
                    }
                },
                "Contract": {
                    "general": [
                        "MUST do \u2014 \"|\" + |lit|`Must` + \"|\"",
                        "MUST do \u2014 \"|\" + |lit|`must` + \"|\"",
                        "MUST NOT do \u2014 \"|\" + |lit|`Must_not` + \"|\"",
                        "MUST NOT do \u2014 \"|\" + |lit|`must_not` + \"|\"",
                        "SHOULD do \u2014 \"|\" + |lit|`Should` + \"|\"",
                        "SHOULD do \u2014 \"|\" + |lit|`should` + \"|\"",
                        "SHOULD NOT do \u2014 \"|\" + |lit|`Should_not` + \"|\"",
                        "SHOULD NOT do \u2014 \"|\" + |lit|`should_not` + \"|\"",
                        "MAY do \u2014 \"|\" + |lit|`May` + \"|\"",
                        "MAY do \u2014 \"|\" + |lit|`may` + \"|\""
                    ]
                },
                "Notes": {
                    "Flavour": [
                        "Normativity keywords are rendered in flavour |value|`rfc-2119` in this showcase, i.e. capitalized."
                    ],
                    "Roles": [
                        "* |attr|`ABC` \u2014 |lit|`|attr|`, for attributes in XML, keys in JSON...",
                        "* |class|`ABC` \u2014 |lit|`|class|`, classes",
                        "* |cmd|`ABC` \u2014 |lit|`|cmd|`, commands and subcommand with CLI",
                        "* |dfn|`ABC` \u2014 |lit|`|dfn|`, a term being defined",
                        "* |file|`/path/to/ABC` \u2014 |lit|`|file|`, files but also URLs",
                        "* |func|`ABC` \u2014 |lit|`|func|`, functions",
                        "* |key|`CTRL` \u2014 |lit|`|label|`, keys on the keyboard",
                        "* |label|`ABC` \u2014 |lit|`|label|`, titles, labels",
                        "* |lit|`ABC` \u2014 |lit|`|lit|`, catch-all for literal text",
                        "* |mod|`ABC` \u2014 |lit|`|mod|`, modules",
                        "* |norm|`should` \u2014 |lit|`|norm|`, normativity keywords (meta, when talking about keywords)",
                        "* |op|`>>` \u2014 |lit|`|op|`, operators",
                        "* |opt|`--abc` \u2014 |lit|`|opt|`, options for CLI commands",
                        "* |pkg|`sdv.tty` \u2014 |lit|`|pkg|`, packages",
                        "* |tag|`ABC` \u2014 |lit|`|tag|`, enum values, symbolic values",
                        "* |term|`ABC` \u2014 |lit|`|term|`, referencing a term defined in |label|`Definitions`",
                        "* |type|`float` \u2014 |lit|`|type|`, types in programming or markup languages",
                        "* |url|`https://pypi.org/project/sdv-doc-waterloo/` \u2014 |lit|`|url|`, for URLs (currently pretty simple)",
                        "* |value|`12345` \u2014 |lit|`|value|`, R-values, unnamed values",
                        "* |var|`xyz` \u2014 |lit|`|var|`, variables, but also named constants",
                        "* |var_type|`xyz:float` \u2014 |lit|`|var_type|`, variable and type with colon."
                    ],
                    "Values": [
                        "* |Self| \u2014 |lit|`|Self|`",
                        "* |None| \u2014 |lit|`|None|`",
                        "* |True| \u2014 |lit|`|True|`",
                        "* |False| \u2014 |lit|`|False|`"
                    ],
                    "Todo at 2026-06-25": [
                        "Styles for pkg and url required."
                    ]
                }
            }
        },
        "showcase_roles.X": {
            "signature": {
                "text": "object.__init__(self, /, *args, **kwargs)",
                "parameters": [
                    {
                        "name": "args",
                        "kind": "VAR_POSITIONAL",
                        "annotation": null,
                        "default": null
                    },
                    {
                        "name": "kwargs",
                        "kind": "VAR_KEYWORD",
                        "annotation": null,
                        "default": null
                    }
                ],
                "returns": null
            },
            "doc": {
                "Preamble": {
                    "profile": "class",
                    "normative_sections": [
                        "Contract",
                        "Definitions"
                    ]
                },
                "Contract": {
                    "general": [
                        "MUST demonstrate the use of |lit|`|term|` in a class."
                    ],
                    "constructor": []
                },
                "definitions_inherited_from_module": {
                    "source": "/__WTRL_OBJECTS__/showcase_roles",
                    "terms": [
                        "ABC"
                    ]
                },
                "Definitions": {},
                "Notes": {
                    "Roles": [
                        "* |term|`ABC` \u2014 |lit|`|term|`, referencing a term defined in |label|`Definitions`"
                    ],
                    "Compound examples": [
                        "|cmd|`waterlint validate` |opt|`--basedir` |file|`/path/to/dir` |opt|`--obj` |mod|`mymod`"
                    ]
                }
            }
        }
    }
}
