{
    "$schema": "https://sci-d-vis.com/schema/wtrl-json-0.3.0.schema.json",
    "$id": "urn:waterlint:wtrl-json:0.25.2:core:rfc-2119:7ae8e1dd1fdd4801edfd21f37e076485c67d267e8f763803df66ebfdb86fc3e9",
    "__WTRL_VERSION__": {
        "waterloo": "0.25.2",
        "schema": "0.3.0"
    },
    "__WTRL_META__": {
        "generated_at": "2026-09-28T17:42:24+02:00",
        "generator": "waterlint",
        "scope": "core",
        "flavour": "rfc-2119"
    },
    "__WTRL_ROLES__": {
        "attr": "Attribute name",
        "cmd": "Shell or CLI command",
        "class": "Class name",
        "dfn": "Definition of a term",
        "file": "File or path",
        "func": "Function or callable",
        "key": "Key on the keyboard",
        "label": "Section/Subsection label",
        "lit": "Literal text or code",
        "mod": "Module name",
        "norm": "Normativity keyword used as metadata",
        "op": "Operator symbol",
        "opt": "Command-line option or flag",
        "pkg": "Package name",
        "url": "URL",
        "tag": "Tag or marker",
        "term": "Domain-specific term",
        "type": "Type name or annotation",
        "value": "Concrete value",
        "var": "Variable name",
        "var_type": "Variable and type, like 'var:type'"
    },
    "__WTRL_SCOPES__": {
        "public": {
            "value": 10,
            "description": ""
        },
        "extension": {
            "value": 20,
            "description": ""
        },
        "core": {
            "value": 30,
            "description": ""
        }
    },
    "__WTRL_TOC_MODULES__": {
        "test_docitem_method_decorator": "/__WTRL_OBJECTS__/test_docitem_method_decorator"
    },
    "__WTRL_TOC_CLASSES__": {},
    "__WTRL_TOC_CALLABLES__": {
        "test_docitem_method_decorator.fib": "/__WTRL_OBJECTS__/test_docitem_method_decorator.fib"
    },
    "__WTRL_TOC_TYPES__": {},
    "__WTRL_TOC_VARIABLES__": {},
    "__WTRL_TOC_CONSTANTS__": {},
    "__WTRL_OBJECTS__": {
        "test_docitem_method_decorator.fib": {
            "signature": {
                "text": "fib(n: 'int') -> 'int'",
                "parameters": [
                    {
                        "name": "n",
                        "kind": "POSITIONAL_OR_KEYWORD",
                        "annotation": "int",
                        "default": null
                    }
                ],
                "returns": "int"
            },
            "decorators": [
                "@trace",
                "@functools.lru_cache(maxsize=128)"
            ],
            "doc": {
                "Preamble": {
                    "profile": "function",
                    "normative_sections": [
                        "Contract",
                        "Parameters",
                        "Returns",
                        "Raises"
                    ]
                },
                "Contract": {
                    "general": [
                        "MUST compute the |var|`n`-th Fibonacci number.",
                        "MUST cache intermediate results."
                    ]
                },
                "Parameters": {
                    "n": [
                        "The |var|`n` in \"compute the |var|`n`-th Fibonacci number\"."
                    ]
                },
                "Returns": [
                    "The Fibonacci number"
                ],
                "Raises": {
                    "BaseException": [
                        "MAY propagate from |mod| functools."
                    ]
                }
            }
        },
        "test_docitem_method_decorator": {
            "doc": {}
        }
    }
}
